[
  {
    "document_id": "DOC001",
    "document_type": "prescription",
    "date": "2026-08-20",
    "patient_name": "SYNTHETIC PATIENT",
    "diagnoses": ["Hypertension"],
    "medications": [
      {
        "name": "Amlodipine",
        "dose": "5 mg",
        "frequency": "once daily",
        "duration": "30 days"
      }
    ],
    "investigations": ["Lipid Profile"],
    "procedures": []
  },
  {
    "document_id": "DOC002",
    "document_type": "prescription",
    "date": "2026-08-22",
    "patient_name": "SYNTHETIC PATIENT 2",
    "diagnoses": ["Type 2 Diabetes Mellitus"],
    "medications": [
      {
        "name": "Metformin",
        "dose": "500 mg",
        "frequency": "twice daily",
        "duration": "60 days"
      }
    ],
    "investigations": ["HbA1c", "Fasting Blood Sugar"],
    "procedures": []
  }
]
